Type_id,Type_name,Manual
BT00000001,In-Play Betting,現場賭博，指的是在比賽進行中的某些特定時刻進行投注。例如，賽事中的某一刻，玩家可以根據當時的情況下注某隊是否會得分、比賽是否會進入加時等
BT00000002,Over/Under,玩家預測比賽的總得分是否超過或低於賠率設定的某一數值
BT00000003,In-Play Betting,現場賭博，指的是在比賽進行中的某些特定時刻進行投注。例如，賽事中的某一刻，玩家可以根據當時的情況下注某隊是否會得分、比賽是否會進入加時等
BT00000004,Asian Handicap,亞洲讓分可以避免平局的情況，讓投注者只有勝利或失敗的選擇。例如，給予較弱的隊伍一定的優勢（讓分）
BT00000005,Point Spread,在某些情況下，博彩公司會設置一個分數差距（讓分），投注者需要選擇該隊是否能夠超過這個差距或未能達到這個差距
BT00000006,Moneyline,玩家選擇賽事的勝方或敗方
BT00000007,Asian Handicap,亞洲讓分可以避免平局的情況，讓投注者只有勝利或失敗的選擇。例如，給予較弱的隊伍一定的優勢（讓分）
